"Story","Title","Result","Date","Stability","Duration (s)"
"Mentee create a post","Verify create new post with file","SUCCESS","2022-11-13T23:36:26.732+07:00[Asia/Bangkok]","0.0","9.88"
"Mentee create a post","Verify create new post without file","SUCCESS","2022-11-13T23:36:41.734+07:00[Asia/Bangkok]","0.0","8.05"
"View More Comments and Hide Comments","Verify Hide All comment functionality","SUCCESS","2022-11-14T01:32:19.243+07:00[Asia/Bangkok]","0.0","9.34"
"View More Comments and Hide Comments","Verify View All comment functionality","SUCCESS","2022-11-14T01:35:07.88+07:00[Asia/Bangkok]","0.0","10.52"
"Mentor post a comment","Verify create new comments","SUCCESS","2022-11-14T01:59:23.613+07:00[Asia/Bangkok]","0.0","11.57"
